{
  "assurance_corpus": {
    "case_count": 130,
    "relative_path": "data/assurance/step11a_policy_rule_coverage_corpus.jsonl",
    "sha256": "d51747056c4f920d5e0b6bfb51613b4e1ee1910de82770aa179dd3fe77f68ded"
  },
  "catalog": {
    "catalog_id": "AEGIS-METAMORPHIC-RELATION-CATALOG",
    "relative_path": "policies/assurance/metamorphic_relation_catalog_v1.yaml",
    "sha256": "d5f5be9616f1bbe97775d94e10b9699c31a0a4db6f449dac7687b2a3f38cc175",
    "version": "1.0.0"
  },
  "decision_policy": {
    "relative_path": "policies/decision/federal_base_policy_v1.yaml",
    "sha256": "fd5f39cec54f4bb57491d60bff9326f9b854209d3ab907cdab8768029a35447f"
  },
  "generated_at": "2026-07-14T00:43:42.676210+00:00",
  "harness_error_relation_ids": [],
  "input_integrity_checks_after": {
    "asset_fixture": {
      "actual_sha256": "bc9cb98980010ca2bc1c123e808296a2e17bb34a5735cf42cd07e1efcfc64395",
      "exists": true,
      "expected_sha256": "bc9cb98980010ca2bc1c123e808296a2e17bb34a5735cf42cd07e1efcfc64395",
      "passed": true,
      "relative_path": "data/sample_inputs/assets/valid_healthcare_asset.json",
      "safe_path": true
    },
    "assurance_corpus": {
      "actual_sha256": "d51747056c4f920d5e0b6bfb51613b4e1ee1910de82770aa179dd3fe77f68ded",
      "exists": true,
      "expected_sha256": "d51747056c4f920d5e0b6bfb51613b4e1ee1910de82770aa179dd3fe77f68ded",
      "passed": true,
      "relative_path": "data/assurance/step11a_policy_rule_coverage_corpus.jsonl",
      "safe_path": true
    },
    "assurance_manifest": {
      "actual_sha256": "d1fdd9308b973e5248e464daf528a376bca6bc6c27b9d45f267b88f842797465",
      "exists": true,
      "expected_sha256": "d1fdd9308b973e5248e464daf528a376bca6bc6c27b9d45f267b88f842797465",
      "passed": true,
      "relative_path": "data/assurance/step11a_policy_rule_coverage_manifest.json",
      "safe_path": true
    },
    "component_fixture": {
      "actual_sha256": "7d557b127eb2cb6ae097be75273cad3e3d0cd0876385dd74d2439c762254f37a",
      "exists": true,
      "expected_sha256": "7d557b127eb2cb6ae097be75273cad3e3d0cd0876385dd74d2439c762254f37a",
      "passed": true,
      "relative_path": "data/sample_inputs/decisions/valid_log4shell_decision_record_policy.json",
      "safe_path": true
    },
    "decision_policy": {
      "actual_sha256": "fd5f39cec54f4bb57491d60bff9326f9b854209d3ab907cdab8768029a35447f",
      "exists": true,
      "expected_sha256": "fd5f39cec54f4bb57491d60bff9326f9b854209d3ab907cdab8768029a35447f",
      "passed": true,
      "relative_path": "policies/decision/federal_base_policy_v1.yaml",
      "safe_path": true
    },
    "intelligence_fixture": {
      "actual_sha256": "e2204ab8ff8736c0826ffe24d518cef462a75dcea7e498943506b0fe7f41ff1f",
      "exists": true,
      "expected_sha256": "e2204ab8ff8736c0826ffe24d518cef462a75dcea7e498943506b0fe7f41ff1f",
      "passed": true,
      "relative_path": "data/sample_inputs/intelligence/valid_log4shell_intelligence.json",
      "safe_path": true
    },
    "step11a_report": {
      "actual_sha256": "6226d36646b0d00a22b9c7f4d7efcea216e705bbd1143b1caef07a97e41fd710",
      "exists": true,
      "expected_sha256": "6226d36646b0d00a22b9c7f4d7efcea216e705bbd1143b1caef07a97e41fd710",
      "passed": true,
      "relative_path": "data/validation_reports/assurance/step11a_policy_rule_coverage_report.json",
      "safe_path": true
    },
    "step11b_report": {
      "actual_sha256": "73365a05f63fe4ee0cf51fed471c8a3846679f4ae737cc033be670220de5ceb1",
      "exists": true,
      "expected_sha256": "73365a05f63fe4ee0cf51fed471c8a3846679f4ae737cc033be670220de5ceb1",
      "passed": true,
      "relative_path": "data/validation_reports/mutation/step11b_policy_mutation_report.json",
      "safe_path": true
    },
    "step11c_report": {
      "actual_sha256": "74f0849ee40aa73f09b9abf23929bbaf4a355d51f00c9b01958b01f943867a23",
      "exists": true,
      "expected_sha256": "74f0849ee40aa73f09b9abf23929bbaf4a355d51f00c9b01958b01f943867a23",
      "passed": true,
      "relative_path": "data/validation_reports/tampering/step11c_tamper_assurance_report.json",
      "safe_path": true
    },
    "step11d_report": {
      "actual_sha256": "8c21529e07fa9b9b196a002d64fa302e7f9ec10da3e1fec9b7070bdd6d6b6f69",
      "exists": true,
      "expected_sha256": "8c21529e07fa9b9b196a002d64fa302e7f9ec10da3e1fec9b7070bdd6d6b6f69",
      "passed": true,
      "relative_path": "data/validation_reports/hostile_inputs/step11d_hostile_input_report.json",
      "safe_path": true
    }
  },
  "input_integrity_checks_before": {
    "asset_fixture": {
      "actual_sha256": "bc9cb98980010ca2bc1c123e808296a2e17bb34a5735cf42cd07e1efcfc64395",
      "exists": true,
      "expected_sha256": "bc9cb98980010ca2bc1c123e808296a2e17bb34a5735cf42cd07e1efcfc64395",
      "passed": true,
      "relative_path": "data/sample_inputs/assets/valid_healthcare_asset.json",
      "safe_path": true
    },
    "assurance_corpus": {
      "actual_sha256": "d51747056c4f920d5e0b6bfb51613b4e1ee1910de82770aa179dd3fe77f68ded",
      "exists": true,
      "expected_sha256": "d51747056c4f920d5e0b6bfb51613b4e1ee1910de82770aa179dd3fe77f68ded",
      "passed": true,
      "relative_path": "data/assurance/step11a_policy_rule_coverage_corpus.jsonl",
      "safe_path": true
    },
    "assurance_manifest": {
      "actual_sha256": "d1fdd9308b973e5248e464daf528a376bca6bc6c27b9d45f267b88f842797465",
      "exists": true,
      "expected_sha256": "d1fdd9308b973e5248e464daf528a376bca6bc6c27b9d45f267b88f842797465",
      "passed": true,
      "relative_path": "data/assurance/step11a_policy_rule_coverage_manifest.json",
      "safe_path": true
    },
    "component_fixture": {
      "actual_sha256": "7d557b127eb2cb6ae097be75273cad3e3d0cd0876385dd74d2439c762254f37a",
      "exists": true,
      "expected_sha256": "7d557b127eb2cb6ae097be75273cad3e3d0cd0876385dd74d2439c762254f37a",
      "passed": true,
      "relative_path": "data/sample_inputs/decisions/valid_log4shell_decision_record_policy.json",
      "safe_path": true
    },
    "decision_policy": {
      "actual_sha256": "fd5f39cec54f4bb57491d60bff9326f9b854209d3ab907cdab8768029a35447f",
      "exists": true,
      "expected_sha256": "fd5f39cec54f4bb57491d60bff9326f9b854209d3ab907cdab8768029a35447f",
      "passed": true,
      "relative_path": "policies/decision/federal_base_policy_v1.yaml",
      "safe_path": true
    },
    "intelligence_fixture": {
      "actual_sha256": "e2204ab8ff8736c0826ffe24d518cef462a75dcea7e498943506b0fe7f41ff1f",
      "exists": true,
      "expected_sha256": "e2204ab8ff8736c0826ffe24d518cef462a75dcea7e498943506b0fe7f41ff1f",
      "passed": true,
      "relative_path": "data/sample_inputs/intelligence/valid_log4shell_intelligence.json",
      "safe_path": true
    },
    "step11a_report": {
      "actual_sha256": "6226d36646b0d00a22b9c7f4d7efcea216e705bbd1143b1caef07a97e41fd710",
      "exists": true,
      "expected_sha256": "6226d36646b0d00a22b9c7f4d7efcea216e705bbd1143b1caef07a97e41fd710",
      "passed": true,
      "relative_path": "data/validation_reports/assurance/step11a_policy_rule_coverage_report.json",
      "safe_path": true
    },
    "step11b_report": {
      "actual_sha256": "73365a05f63fe4ee0cf51fed471c8a3846679f4ae737cc033be670220de5ceb1",
      "exists": true,
      "expected_sha256": "73365a05f63fe4ee0cf51fed471c8a3846679f4ae737cc033be670220de5ceb1",
      "passed": true,
      "relative_path": "data/validation_reports/mutation/step11b_policy_mutation_report.json",
      "safe_path": true
    },
    "step11c_report": {
      "actual_sha256": "74f0849ee40aa73f09b9abf23929bbaf4a355d51f00c9b01958b01f943867a23",
      "exists": true,
      "expected_sha256": "74f0849ee40aa73f09b9abf23929bbaf4a355d51f00c9b01958b01f943867a23",
      "passed": true,
      "relative_path": "data/validation_reports/tampering/step11c_tamper_assurance_report.json",
      "safe_path": true
    },
    "step11d_report": {
      "actual_sha256": "8c21529e07fa9b9b196a002d64fa302e7f9ec10da3e1fec9b7070bdd6d6b6f69",
      "exists": true,
      "expected_sha256": "8c21529e07fa9b9b196a002d64fa302e7f9ec10da3e1fec9b7070bdd6d6b6f69",
      "passed": true,
      "relative_path": "data/validation_reports/hostile_inputs/step11d_hostile_input_report.json",
      "safe_path": true
    }
  },
  "limitations": [
    "Controlled deterministic corpus only; not a substitute for live operational validation.",
    "Relations validate policy monotonicity, not deployment security or human workflow performance."
  ],
  "quality_gates": [
    {
      "gate_id": "META-CRITICAL-PASS-RATE",
      "metric": "critical_relation_pass_rate",
      "observed": 1.0,
      "operator": "gte",
      "passed": true,
      "threshold": 1.0
    },
    {
      "gate_id": "META-SECTOR-NEUTRALITY",
      "metric": "sector_neutrality_consistency_rate",
      "observed": 1.0,
      "operator": "gte",
      "passed": true,
      "threshold": 1.0
    },
    {
      "gate_id": "META-DANGER-MONOTONICITY",
      "metric": "danger_escalation_monotonicity_rate",
      "observed": 1.0,
      "operator": "gte",
      "passed": true,
      "threshold": 1.0
    },
    {
      "gate_id": "META-TRUST-FAIL-CLOSED",
      "metric": "trust_degradation_fail_closed_rate",
      "observed": 1.0,
      "operator": "gte",
      "passed": true,
      "threshold": 1.0
    },
    {
      "gate_id": "META-DEADLINE-MONOTONICITY-RATE",
      "metric": "deadline_monotonicity_rate",
      "observed": 1.0,
      "operator": "gte",
      "passed": true,
      "threshold": 1.0
    },
    {
      "gate_id": "META-REVIEW-MONOTONICITY-RATE",
      "metric": "review_monotonicity_rate",
      "observed": 1.0,
      "operator": "gte",
      "passed": true,
      "threshold": 1.0
    },
    {
      "gate_id": "META-CONTAINMENT-MONOTONICITY-RATE",
      "metric": "containment_monotonicity_rate",
      "observed": 1.0,
      "operator": "gte",
      "passed": true,
      "threshold": 1.0
    },
    {